url,description,name,Herkunftsland,Anbauregion,Weingut,Marke,Produktkategorie,Qualitätsstufe,Cuvee,Jahrgang,Geschmacksrichtung,Farbnuance,Flaschengröße,Alkoholgehalt,Restzucker,Säure,Trinktemperatur,Passende Speisen,Hinweis auf Allergene,Hersteller,Model,Generierte Beschreibung,Tonalität
https://www.vindor.de/rockabilly-weinkult-betty-rose-weinviertel,"Achtung: Hoher Kultfaktor ! Die Rock’n’Roll-Winzer aus Österreich: Rockabilly Weinkult – Wein, der rockt, und das nicht nur bei Genießern mit Tolle.
Der Rockabilly Weinkult ""Betty"" Rosé überzeugt durch seine wunderbare Frische und ausgeprägte Fruchtigkeit. In der Nase sehr fruchtig nach roten Beeren und etwas frischer Minze, kühle Aromatik, die Frucht spiegelt sich am Gaumen wieder, frisch, knackig und saftig. Ein Rosé der Lust aufs nächste Glas mach und DER ROCKT !","Rockabilly Weinkult, Betty Rosé, Weinviertel",Österreich,Weinviertel,Weingut Rockabilly Weinkult,Rockabilly Weinkult,Roséwein,Qualtätswein aus Österreich,"Zweigelt, Cabernet Sauvignon",2018,trocken,leuchtendes Lachsrosa,"0,75 l",12 %,"7,3 g/l","6,3 g/l",8-9 °C,"Zu Salaten, Gegrilltem oder geschmortem Fleisch, gefüllten Paprika, Nudelgerichten oder Käse (Cantal).",enthält Sulfite,"Weingut Rockabilly Weinkult,  Ramona & René Pollak, Hauptstraße 21, 2074 Unterretzbach - Österreich",OpenAI: text-davinci-003,"
Der Rockabilly Weinkult Zweigelt Cuvee 2018 ist ein Qualitätswein aus Österreich. Er wird im Weinviertel, im Weingut Rockabilly Weinkult, von Ramona & René Pollak, hergestellt. Der Wein hat ein leuchtendes Lachsrosa und einen Alkoholgehalt von 12%. 

Dieser trockene Roséwein ist eine Cuvee aus Zweigelt und Cabernet Sauvignon. Er ist ein sehr vielseitiger Begleiter für leichte und frische Speisen. Er passt hervorragend zu Salaten, gegrilltem oder geschmortem Fleisch, gefüllten Paprika, Nudelgerichten oder Käse (Cantal).

Der Rockabilly Weinkult Zweigelt Cuvee 2018 ist ein ausdrucksstarker Wein mit einer Fülle an Aromen und Düften. Seine Noten von reifen Beerenfrüchten und dem leichten Anklang von Gewürzen machen ihn zu einem einzigartigen und unvergesslichen Genuss. 

Der Rockabilly Weinkult Zweigelt Cuvee 2018 ist ein Qualitätswein aus Österreich, der Allergikern bewusst sein sollte, da er Sulfite enthält. Genießen Sie diesen Wein mit Freunden und Familie und erleben Sie ein unvergessliches Geschmackserlebnis.",professionell
https://www.vindor.de/edlmoser-laessiger-zweigelt-niederoesterreich,"Wenn Sie es gern locker mögen, oder wie der Österreicher sagt LÄSSIG, ist dieser Wein genau das Richtige für Sie. Der LAESSIGER Zweigelt duftet nach Kirschen und Zwetschgen. Betört mit weicher, saftiger Frucht.","Edlmoser, Laessiger Zweigelt, Niederösterreich",Österreich,Niederösterreich,Edlmoser Wines,Laessiger,Rotwein,,,2020,trocken,kräftiges Dunkelrot,"0,75 l",13 %,"5,0 g/l","4,8 g/l",14-16 °C,"Caprese, Tapas, Burger, Steak oder Tafelspitz.",enthält Sulfite,"Edlmoser Weingut & Heuriger, Maurer Lange Gasse 123 - 1230 Wien - Österreich",OpenAI: text-davinci-003,"
Der Laessiger Rotwein des Edlmoser Weinguts & Heurigers aus Niederösterreich ist ein kräftiges Dunkelrot mit einem Alkoholgehalt von 13 %. Der Jahrgang 2020 ist trocken und besitzt eine feine Fruchtigkeit. Er verfügt über ein Bouquet an Aromen von schwarzen Johannisbeeren und Pflaumen, unterstrichen von einer leichten Würze. Dazu kommen feine Noten von Vanille und Nelken. Der Laessiger Rotwein passt hervorragend zu Caprese, Tapas, Burger, Steak oder Tafelspitz. Aufgrund des enthaltenen Sulfits ist der Laessiger Rotwein für Allergiker nicht geeignet. Genießen Sie diesen erstklassigen Wein aus Österreich und lassen Sie sich begeistern.",professionell
https://www.vindor.de/diemersdal-sauvignon-blanc-durbanville,"Ein Geschenk des Himmels. Wenn Sie Sauvignon Blanc lieben, müssen Sie diesen Wein probieren. Frisch, knackig, saftig und spannungsgeladen präsentiert sich dieser Wein. Herrlich komplexe tropischen Noten wie reife Feige und Stachelbeere. Diese ausgeprägten, knackigen Aromen und der mineralische Charakter ergeben eine begeisternden Wein, der in diesem Segment fast unschlagbar ist, wie wir meinen. Vielfach prämierter Spitenwein.","Diemersdal, Sauvignon Blanc, Durbanville",Südafrika,Durbanville,Diemersdal,Diemersdal,Weißwein,,,2022,trocken,hellgelb mit grünlichen Reflexen,"0,75 l",13 %,"3,3 g/l","6,8 g/l",8-9 °C,"Zur leichten Sommerküche, Fisch- und Geflügelgerichte an knackigen Salat, Curry´s oder nur für sich.",enthält Sulfite,"Diemersdal Wine Estate, Koeberg Rd, Durbanville, Cape Town, 7550 - Südafrika",OpenAI: text-davinci-003,"
Der Diemersdal Wein aus Südafrika ist ein trockener Weißwein mit einer hellgelben Farbe und grünlichen Reflexen. Der Alkoholgehalt beträgt 13%. Dieser Wein ist ein perfekter Begleiter für leichte Sommerküche, Fisch- und Geflügelgerichte an knackigen Salaten, Curry´s oder auch allein zu genießen. Er überzeugt durch seine frischen Aromen und Düfte von Zitrusfrüchten, grünem Apfel und Birne. Der Wein ist ein echter Genuss und ein perfekter Begleiter für ein sommerliches Picknick. 

Der Diemersdal Wein wird von der Diemersdal Wine Estate in Durbanville, Südafrika, hergestellt. Der Wein enthält Sulfite. Genießen Sie diesen Wein und lassen Sie sich von den frischen Aromen und Düften verzaubern.",professionell