url,description,name,Herkunftsland,Anbauregion,Weingut,Marke,Produktkategorie,Qualitätsstufe,Cuvee,Jahrgang,Geschmacksrichtung,Farbnuance,Flaschengröße,Alkoholgehalt,Restzucker,Säure,Trinktemperatur,Passende Speisen,Hinweis auf Allergene,Hersteller,Model,Generierte Beschreibung,Tonalität
https://www.vindor.de/edlmoser-laessiger-zweigelt-niederoesterreich,"Wenn Sie es gern locker mögen, oder wie der Österreicher sagt LÄSSIG, ist dieser Wein genau das Richtige für Sie. Der LAESSIGER Zweigelt duftet nach Kirschen und Zwetschgen. Betört mit weicher, saftiger Frucht.","Edlmoser, Laessiger Zweigelt, Niederösterreich",Österreich,Niederösterreich,Edlmoser Wines,Laessiger,Rotwein,,,2020,trocken,kräftiges Dunkelrot,"0,75 l",13 %,"5,0 g/l","4,8 g/l",14-16 °C,"Caprese, Tapas, Burger, Steak oder Tafelspitz.",enthält Sulfite,"Edlmoser Weingut & Heuriger, Maurer Lange Gasse 123 - 1230 Wien - Österreich",OpenAI: text-davinci-003,"Flaschengröße: 0,75 Liter,
Alkoholgehalt: 12,0 Vol.%

Der Laessiger Rotwein von Edlmoser Wines ist ein kräftiges Dunkelrot und hat einen trockenen Geschmack. Er überzeugt durch seine reifen Aromen von reifen roten Beeren, Pflaumen und Gewürzen. Sein samtiger und weicher Abgang lässt den Wein zu einem unvergesslichen Erlebnis werden. Der Laessiger Rotwein ist ein wunderbarer Begleiter zu Caprese, Tapas, Burger, Steak oder Tafelspitz. Genießen Sie die besondere Qualität des Laessiger Rotweins und lassen Sie sich von seinem einzigartigen Geschmack überraschen.",professionell
https://www.vindor.de/diemersdal-sauvignon-blanc-durbanville,"Ein Geschenk des Himmels. Wenn Sie Sauvignon Blanc lieben, müssen Sie diesen Wein probieren. Frisch, knackig, saftig und spannungsgeladen präsentiert sich dieser Wein. Herrlich komplexe tropischen Noten wie reife Feige und Stachelbeere. Diese ausgeprägten, knackigen Aromen und der mineralische Charakter ergeben eine begeisternden Wein, der in diesem Segment fast unschlagbar ist, wie wir meinen. Vielfach prämierter Spitenwein.","Diemersdal, Sauvignon Blanc, Durbanville",Südafrika,Durbanville,Diemersdal,Diemersdal,Weißwein,,,2022,trocken,hellgelb mit grünlichen Reflexen,"0,75 l",13 %,"3,3 g/l","6,8 g/l",8-9 °C,"Zur leichten Sommerküche, Fisch- und Geflügelgerichte an knackigen Salat, Curry´s oder nur für sich.",enthält Sulfite,"Diemersdal Wine Estate, Koeberg Rd, Durbanville, Cape Town, 7550 - Südafrika",OpenAI: text-davinci-003,"Flaschengröße: 0,75 Liter,
Alkoholgehalt: 12,5 %

Dieser helle Diemersdal Weißwein aus Südafrika ist ein trockener Genuss. Der Jahrgang 2022 zeigt sich in einem hellgelben Farbton mit grünlichen Reflexen. Der Wein ist frisch und fruchtig mit einer feinen, mineralischen Note. Aromen von Zitrusfrüchten, Pfirsich und Aprikose machen den Wein zu einem besonderen Erlebnis. Der Diemersdal Weißwein ist ein idealer Begleiter zur leichten Sommerküche, Fisch- und Geflügelgerichten an knackigen Salaten, Curry´s oder auch einfach nur für sich. Genießen Sie den Wein bei einer Temperatur von 8-9°C.",professionell